{
  "name": "small",
  "l": ["q0", "q1", "q2"],
  "sigma": ["a", "b"],
  "tran": {
    "0": ["q0", "a", "[0,1)", "q1"],
    "1": ["q0", "a", "[1,+)", {"and": ["q1", "q2"]}],
    "2": ["q1", "b", "(0,2]", {"or": ["q1", "q2"]}],
    "3": ["q2", "a", "[0,+)", {"const": false}]
  },
  "init": ["q0", "q2"],
  "accept": ["q1"]
}
