{
  "name": "untimed",
  "l": ["q0", "q1", "q2"],
  "sigma": ["a", "b"],
  "tran": {
    "0": ["q0", "a", "[0,+)", "q2"],
    "1": ["q0", "b", "[0,+)", {"and": ["q0", "q1", "q2"]}],
    "2": ["q1", "a", "[0,+)", {"and": ["q1", "q2"]}],
    "3": ["q2", "a", "[0,+)", {"and": ["q1", "q2"]}],
    "4": ["q2", "b", "[0,+)", {"and": ["q1", "q2"]}]
  },
  "init": ["q0"],
  "accept": ["q1", "q2"]
}
