{
  "name": "running",
  "l": ["q0", "q1", "q2"],
  "sigma": ["a", "b"],
  "tran": {
    "0": ["q0", "a", "[0,3]", "q1"],
    "1": ["q0", "b", "[2,+)", {"and": ["q0", "q1"]}],
    "2": ["q0", "b", "[3,7]", "q2"],
    "3": ["q1", "a", "[0,+)", "q0"],
    "4": ["q1", "b", "[0,+)", "q2"],
    "5": ["q2", "b", "[0,+)", "q2"]
  },
  "init": ["q0"],
  "accept": ["q2"]
}
